{
  "$schema": "https://schemas.alos.dev/v1/evidence/evidence-ref.schema.json",
  "tenant_id": "tenant_andara_001",
  "organization_id": "org_andara_001",
  "workspace_id": "workspace_research_001",
  "run_id": "run_external_research_001",
  "correlation_id": "corr_external_research_001",
  "scope_refs": ["scope.project.market-study"],
  "evidence_id": "evidence_external_market_001",
  "source_id": "source_external_market_001",
  "uri": "https://example.com/reports/market-001",
  "captured_at": "2026-09-19T08:00:00Z",
  "retrieved_at": "2026-09-19T08:01:00Z",
  "content_hash": "sha256:bbbbbbbbbbbbbbbbbbbbbbbbbbbbbbbbbbbbbbbbbbbbbbbbbbbbbbbbbbbbbbbb",
  "source_version": "2026-09-19",
  "anchor": "section:1",
  "data_classification": "PUBLIC",
  "validation_status": "PENDING",
  "source_type": "EXTERNAL",
  "freshness": "CURRENT",
  "reliability": "UNVERIFIED",
  "content_trust": "UNTRUSTED",
  "instruction_authority": false
}
