{
  "$schema": "https://schemas.alos.dev/v1/evidence/evidence-ref.schema.json",
  "evidence_id": "evidence_mvp1_document_001",
  "source_id": "source_mvp1_document_001",
  "uri": "https://evidence.alos.dev/mvp1/document/001",
  "captured_at": "2026-09-16T02:00:00Z",
  "content_hash": "sha256:aaaaaaaaaaaaaaaaaaaaaaaaaaaaaaaaaaaaaaaaaaaaaaaaaaaaaaaaaaaaaaaa",
  "source_version": "1",
  "anchor": "section-1",
  "excerpt": "Approved source excerpt used by the migrated MVP-1 fixture.",
  "data_classification": "INTERNAL",
  "validation_status": "VALID",
  "metadata": {
    "legacy_citation_key": "DOC_001_SECTION_1"
  }
}
